{
  "schema_version": 1,
  "module_id": "visualizer",
  "purpose": "Terminal diagnostics and native Ebitengine renderer over VM snapshots and domain events",
  "paths": [
    {
      "path": "vm/internal/visual/visual.go",
      "lifecycle": "implemented",
      "provenance": "authored"
    },
    {
      "path": "vm/visualizer/main.go",
      "lifecycle": "implemented",
      "provenance": "authored"
    },
    {
      "path": "vm/visualizer/game.go",
      "lifecycle": "implemented",
      "provenance": "authored"
    }
  ],
  "contracts": [
    "vm/internal/corewar/events.go"
  ],
  "validators": [
    "cd vm/visualizer && go vet ./..."
  ],
  "tests": [
    "vm/visualizer/game_test.go"
  ]
}
